{
  "$schema": "https://json-schema.org/draft/2020-12/schema",
  "title": "Decodex upstream impact",
  "type": "object",
  "additionalProperties": false,
  "required": [
    "schema",
    "slug",
    "repo",
    "source_refs",
    "observed_change",
    "public_signal_decision",
    "control_plane_impact",
    "publisher_angle",
    "confidence",
    "evidence"
  ],
  "properties": {
    "schema": {
      "const": "upstream_impact/v1"
    },
    "slug": {
      "type": "string",
      "minLength": 1
    },
    "repo": {
      "type": "string",
      "minLength": 1
    },
    "source_refs": {
      "type": "object",
      "additionalProperties": false,
      "required": ["items"],
      "properties": {
        "items": {
          "type": "array",
          "minItems": 1,
          "items": {
            "type": "object",
            "additionalProperties": false,
            "required": ["kind", "title", "url"],
            "properties": {
              "kind": {
                "type": "string",
                "enum": ["pull_request", "commit", "release", "changelog", "signal", "browser_observation"]
              },
              "title": {
                "type": "string",
                "minLength": 1
              },
              "url": {
                "type": "string",
                "pattern": "^https://"
              },
              "meta": {
                "type": "string",
                "minLength": 1
              }
            }
          }
        }
      }
    },
    "observed_change": {
      "type": "string",
      "minLength": 1
    },
    "public_signal_decision": {
      "type": "string",
      "enum": ["publish", "defer", "skip"]
    },
    "control_plane_impact": {
      "type": "string",
      "enum": ["none", "watch", "candidate", "compat_risk", "adopt_now"]
    },
    "publisher_angle": {
      "type": "string",
      "enum": ["none", "release_pulse", "practical_explainer", "operator_impact", "watch_note"]
    },
    "confidence": {
      "type": "string",
      "enum": ["confirmed", "likely", "weak"]
    },
    "evidence": {
      "type": "array",
      "minItems": 1,
      "items": {
        "type": "string",
        "minLength": 1
      }
    },
    "candidate_followups": {
      "type": "array",
      "items": {
        "type": "string",
        "minLength": 1
      }
    },
    "social_notes": {
      "type": "array",
      "items": {
        "type": "string",
        "minLength": 1
      }
    },
    "caveats": {
      "type": "array",
      "items": {
        "type": "string",
        "minLength": 1
      }
    }
  }
}
