{
  "schema": "upstream_impact/v1",
  "slug": "openai-codex-pr-25636",
  "repo": "openai/codex",
  "source_refs": {
    "items": [
      {
        "kind": "pull_request",
        "title": "[codex] Rename multi-agent v2 assign_task to followup_task",
        "url": "https://github.com/openai/codex/pull/25636",
        "meta": "Merged 2026-06-01T17:57:12Z"
      },
      {
        "kind": "commit",
        "title": "Rename multi-agent v2 assign_task tool",
        "url": "https://github.com/openai/codex/commit/c9bdb5255b2b4b5d365a1be3ec3a94e34a4e0af0"
      }
    ]
  },
  "observed_change": "MultiAgentV2 renamed the turn-triggering agent tool from assign_task to followup_task while keeping legacy assign_task rollout-trace classification.",
  "public_signal_decision": "publish",
  "control_plane_impact": "compat_risk",
  "publisher_angle": "operator_impact",
  "confidence": "confirmed",
  "evidence": [
    "PR #25636 states the exposed MultiAgentV2 tool name now better describes sending an additional task to an existing agent.",
    "The tool spec now exposes followup_task and the v2 spec-plan tests assert assign_task is absent.",
    "Rollout trace dispatch still accepts assign_task alongside followup_task, so historical trace reduction remains compatible.",
    "Decodex currently has public MultiAgentV2 content and generated feature references, so a naming audit is actionable before newer upstream schemas are adopted."
  ],
  "candidate_followups": [
    "Audit Decodex docs, site content, prompts, and any future app-server tool-schema adapters for hard-coded assign_task assumptions.",
    "Prefer followup_task in new MultiAgentV2 operator examples while preserving historical assign_task notes only where they describe legacy traces.",
    "When Decodex consumes newer Codex app-server schemas, verify followup_task is routed as the v2 trigger-turn tool and assign_task is not required for new sessions."
  ],
  "social_notes": [
    "Frame as a naming and compatibility heads-up for Codex MultiAgentV2 operators, not as a Decodex runtime feature claim.",
    "Mention that legacy rollout traces still classify assign_task, but newer v2 tool lists should use followup_task."
  ],
  "caveats": [
    "Downstream availability depends on the user's Codex build and enabled MultiAgentV2 feature state.",
    "This artifact does not prove Decodex runtime support for followup_task; it identifies a compatibility audit target."
  ]
}
