{
  "schema": "upstream_impact/v1",
  "slug": "openai-codex-pr-28143",
  "repo": "openai/codex",
  "source_refs": {
    "items": [
      {
        "kind": "pull_request",
        "title": "feat(app-server): expose rate-limit reset credits",
        "url": "https://github.com/openai/codex/pull/28143",
        "meta": "Merged 2026-06-15T21:54:02Z"
      },
      {
        "kind": "pull_request",
        "title": "Source-backed Decodex upstream review",
        "url": "https://github.com/openai/codex/pull/28143",
        "meta": "artifacts/github/reviews/openai-codex-pr-28143.review.json"
      }
    ]
  },
  "observed_change": "Codex app-server now reports earned rate-limit reset credits in `account/rateLimits/read` and adds `account/rateLimitResetCredit/consume` with caller-supplied idempotency.",
  "public_signal_decision": "publish",
  "control_plane_impact": "candidate",
  "publisher_angle": "operator_impact",
  "confidence": "confirmed",
  "evidence": [
    "`GetAccountRateLimitsResponse` now includes nullable `rateLimitResetCredits` with `availableCount`.",
    "The app-server protocol adds `account/rateLimitResetCredit/consume` with a non-empty `idempotencyKey` request parameter.",
    "The consume response returns only an `outcome`; upstream docs tell clients to refetch `account/rateLimits/read` for updated window state.",
    "Consume outcomes are camelCase: `reset`, `nothingToReset`, `noCredit`, and `alreadyRedeemed`.",
    "The app-server processor requires ChatGPT-backed auth and maps backend reset-credit responses through a bounded timeout.",
    "The source-backed review is recorded at `artifacts/github/reviews/openai-codex-pr-28143.review.json`."
  ],
  "candidate_followups": [
    "Audit Decodex account and rate-limit read models for the nullable `rateLimitResetCredits` field.",
    "Consider a guarded Control Plane action for consuming a reset credit with a stable idempotency key per logical user request.",
    "After any consume action, refetch `account/rateLimits/read` instead of deriving updated windows from the consume response."
  ],
  "social_notes": [
    "Frame this as an app-server account API capability for earned rate-limit reset credits.",
    "Avoid implying automatic Decodex support until a separate Control Plane adoption issue is implemented.",
    "Mention idempotency and refetch behavior because they are the operational details client authors need."
  ],
  "caveats": [
    "The feature depends on ChatGPT-backed Codex auth and backend reset-credit availability.",
    "The reset count is exposed on the read snapshot, not as a pushed notification update.",
    "The upstream PR is protocol/backend foundation for a TUI `/usage` flow in a separate PR."
  ]
}
