{
  "schema": "upstream_impact/v1",
  "slug": "openai-codex-pr-27098",
  "repo": "openai/codex",
  "source_refs": {
    "items": [
      {
        "kind": "pull_request",
        "title": "[codex] Return workspace directory installed plugins",
        "url": "https://github.com/openai/codex/pull/27098",
        "meta": "Merged 2026-06-09T08:23:17Z"
      },
      {
        "kind": "pull_request",
        "title": "Source-backed Decodex upstream review",
        "url": "https://github.com/openai/codex/pull/27098",
        "meta": "artifacts/github/reviews/openai-codex-pr-27098.review.json"
      }
    ]
  },
  "observed_change": "Codex app-server `plugin/installed` now includes installed `workspace-directory` remote plugins by default while keeping shared-with-me marketplaces gated behind `plugin_sharing`.",
  "public_signal_decision": "publish",
  "control_plane_impact": "candidate",
  "publisher_angle": "operator_impact",
  "confidence": "confirmed",
  "evidence": [
    "The upstream review records `REMOTE_WORKSPACE_MARKETPLACE_NAME` being included in visible marketplaces by default.",
    "Shared-with-me marketplace names remain gated behind the `plugin_sharing` feature.",
    "Remote installed plugins are filtered by explicit marketplace name instead of coarse scope.",
    "App-server tests assert workspace-directory installed plugins appear without plugin sharing."
  ],
  "candidate_followups": [
    "Use app-server `plugin/installed` readback as Decodex's source for workspace-directory installed plugin visibility.",
    "Keep Decodex shared-with-me plugin UI gated unless upstream `plugin_sharing` is enabled.",
    "Make plugin inventory code tolerant of an additional `workspace-directory` marketplace."
  ],
  "social_notes": [
    "Public copy should distinguish workspace-directory installed plugins from shared-with-me plugins.",
    "Avoid implying remote plugin discovery is enabled globally by this change."
  ],
  "caveats": [
    "The change is readback-focused.",
    "Shared-with-me plugins are still feature-gated."
  ]
}
