{
  "schema": "upstream_impact/v1",
  "slug": "openai-codex-pr-27465",
  "repo": "openai/codex",
  "source_refs": {
    "items": [
      {
        "kind": "pull_request",
        "title": "[codex] Remove redundant plugin app auth state",
        "url": "https://github.com/openai/codex/pull/27465",
        "meta": "Merged 2026-06-11T00:33:56Z"
      },
      {
        "kind": "pull_request",
        "title": "Source-backed Decodex upstream review",
        "url": "https://github.com/openai/codex/pull/27465",
        "meta": "artifacts/github/reviews/openai-codex-pr-27465.review.json"
      }
    ]
  },
  "observed_change": "Codex removed the experimental `needsAuth` field from plugin app summaries and stopped `plugin/read` from contacting Apps MCP only to hydrate unused connector auth state.",
  "public_signal_decision": "publish",
  "control_plane_impact": "compat_risk",
  "publisher_angle": "operator_impact",
  "confidence": "confirmed",
  "evidence": [
    "`AppSummary.needs_auth` is removed from the Rust protocol type.",
    "Generated JSON schemas and TypeScript definitions no longer include `needsAuth`.",
    "`plugin/read` app-summary hydration no longer takes environment manager or MCP manager state.",
    "Plugin install tests preserve `apps_needing_auth` as the auth signal while app summaries drop `needs_auth`."
  ],
  "candidate_followups": [
    "Search Decodex plugin/app-server clients for `needsAuth` or `needs_auth` assumptions.",
    "Prefer `plugin/install.appsNeedingAuth` and `app/list.isAccessible` in future auth-state readbacks.",
    "Update operator docs if they mention `plugin/read.plugin.apps[].needsAuth`."
  ],
  "social_notes": [
    "Frame as an under-development plugin API migration note.",
    "Explain the replacement auth signals explicitly.",
    "Mention the latency reason only as source-backed context from the PR body."
  ],
  "caveats": [
    "The upstream PR states plugin APIs are still under development.",
    "The removal affects plugin app summaries, not plugin install `appsNeedingAuth` membership.",
    "Do not imply all connector auth state has been removed."
  ]
}
