{
  "schema": "upstream_impact/v1",
  "slug": "openai-codex-pr-27591",
  "repo": "openai/codex",
  "source_refs": {
    "items": [
      {
        "kind": "pull_request",
        "title": "skills: render catalog locators by authority",
        "url": "https://github.com/openai/codex/pull/27591",
        "meta": "Merged 2026-06-11T11:51:04Z"
      },
      {
        "kind": "pull_request",
        "title": "Source-backed Decodex upstream review",
        "url": "https://github.com/openai/codex/pull/27591",
        "meta": "artifacts/github/reviews/openai-codex-pr-27591.review.json"
      }
    ]
  },
  "observed_change": "Codex now renders skills catalog source locators by owning authority instead of describing every skill as a host filesystem file.",
  "public_signal_decision": "publish",
  "control_plane_impact": "candidate",
  "publisher_angle": "operator_impact",
  "confidence": "confirmed",
  "evidence": [
    "Available-skills instructions now describe source locators instead of only file paths.",
    "Skill lines are rendered from `SkillSourceKind`, producing file, environment-resource, orchestrator-resource, or custom-resource labels.",
    "App-server coverage asserts `skill://` orchestrator resources are not treated as filesystem paths.",
    "The PR body keeps discovery, provider routing, resource validation, and the `skills.*` tool contract out of scope."
  ],
  "candidate_followups": [
    "Mirror authority-aware locator language in Decodex plugin and skills guidance.",
    "Check Decodex prompt templates for file-path-only assumptions around available skills.",
    "Keep hosted-skill claims limited to catalog rendering unless later PRs change the tool contract."
  ],
  "social_notes": [
    "Good operator-impact candidate for explaining how agents should read hosted skill resources.",
    "Mention `skills.list` and `skills.read` for orchestrator-owned `skill://` resources."
  ],
  "caveats": [
    "No new skill discovery or invocation behavior is introduced.",
    "Local host skills continue to render as file locators.",
    "The change is prompt/catalog rendering, not a plugin protocol expansion."
  ]
}
