{
  "schema": "upstream_impact/v1",
  "slug": "openai-codex-pr-25177",
  "repo": "openai/codex",
  "source_refs": {
    "items": [
      {
        "kind": "pull_request",
        "title": "Preserve cloud requirements across TUI thread resets",
        "url": "https://github.com/openai/codex/pull/25177",
        "meta": "Merged 2026-06-09T01:08:48Z"
      },
      {
        "kind": "pull_request",
        "title": "Source-backed Decodex upstream review",
        "url": "https://github.com/openai/codex/pull/25177",
        "meta": "artifacts/github/reviews/openai-codex-pr-25177.review.json"
      }
    ]
  },
  "observed_change": "Codex TUI config rebuilds for thread transitions now preserve the cloud config bundle loader so cloud requirements survive fresh-session and thread-reset paths.",
  "public_signal_decision": "skip",
  "control_plane_impact": "watch",
  "publisher_angle": "none",
  "confidence": "confirmed",
  "evidence": [
    "The upstream review records the cloud config bundle being threaded through TUI config rebuild paths.",
    "Regression coverage asserts cloud requirements survive the refresh used by `/new`, `/clear`, `/fork`, side conversations, and session picker paths.",
    "No app-server protocol schema or public command contract changed.",
    "The PR's easiest repro depends on cloud requirements and an internal feature example."
  ],
  "candidate_followups": [
    "Watch future Codex managed-config changes before Decodex assumes thread reset clears cloud-managed requirements.",
    "Keep any Decodex TUI interop or reset guidance aligned with cloud requirements persisting across TUI transitions."
  ],
  "social_notes": [
    "Skip standalone public posting for now because the clearest repro is cloud-managed and partly internal."
  ],
  "caveats": [
    "The behavior is most relevant to cloud-managed Codex sessions.",
    "No Decodex implementation surface changes immediately."
  ]
}
