{
  "schema": "upstream_impact/v1",
  "slug": "openai-codex-pr-26486",
  "repo": "openai/codex",
  "source_refs": {
    "items": [
      {
        "kind": "pull_request",
        "title": "Route image edits through referenced file paths",
        "url": "https://github.com/openai/codex/pull/26486",
        "meta": "Merged 2026-06-08T21:23:56Z"
      },
      {
        "kind": "pull_request",
        "title": "Source-backed Decodex upstream review",
        "url": "https://github.com/openai/codex/pull/26486",
        "meta": "artifacts/github/reviews/openai-codex-pr-26486.review.json"
      }
    ]
  },
  "observed_change": "Codex image generation extension replaces the old `action` argument with explicit image references: omitted references generate a new image, while `referenced_image_paths` or a bounded recent-image fallback drive edits.",
  "public_signal_decision": "publish",
  "control_plane_impact": "compat_risk",
  "publisher_angle": "practical_explainer",
  "confidence": "confirmed",
  "evidence": [
    "The upstream review records removal of the `ImagegenAction` enum and addition of `referenced_image_paths` and `num_last_images_to_include`.",
    "The imagegen tool description now tells the model to omit references for generation and prefer `referenced_image_paths` for edits.",
    "The app-server integration test covers an attached model-visible image routed to the edit endpoint.",
    "`ImagegenArgs` denies unknown fields, so action-based callers need to update."
  ],
  "candidate_followups": [
    "Audit Decodex image-generation instructions for old `action` references.",
    "Prefer local referenced image paths when Decodex passes image edit requests through Codex.",
    "Keep fallback recent-image inclusion bounded and only use it when no local path exists."
  ],
  "social_notes": [
    "Public copy can explain the new generate-versus-edit convention.",
    "Mention that old action-based image tool calls need updating."
  ],
  "caveats": [
    "The exact edit behavior depends on target images having local file paths or recent conversation image fallback.",
    "This is an image-generation extension schema change, not a general Codex CLI flag."
  ]
}
