{
  "schema": "upstream_impact/v1",
  "slug": "openai-codex-pr-27035",
  "repo": "openai/codex",
  "source_refs": {
    "items": [
      {
        "kind": "pull_request",
        "title": "Enforce configured network proxy in codex sandbox",
        "url": "https://github.com/openai/codex/pull/27035",
        "meta": "Merged 2026-06-08T21:03:37Z"
      },
      {
        "kind": "pull_request",
        "title": "Source-backed Decodex upstream review",
        "url": "https://github.com/openai/codex/pull/27035",
        "meta": "artifacts/github/reviews/openai-codex-pr-27035.review.json"
      }
    ]
  },
  "observed_change": "Codex sandbox now treats any active configured network proxy as the condition for proxy-only network containment across macOS and Linux sandbox paths.",
  "public_signal_decision": "publish",
  "control_plane_impact": "compat_risk",
  "publisher_angle": "operator_impact",
  "confidence": "confirmed",
  "evidence": [
    "The upstream review records `enforce_managed_network` being derived from an active proxy rather than managed requirements.",
    "Linux sandbox arguments now let proxy-only networking take precedence over legacy landlock.",
    "Sandbox manager checks make an active proxy require bubblewrap support.",
    "The Linux regression test asserts a sandboxed direct loopback connection is blocked."
  ],
  "candidate_followups": [
    "Surface bubblewrap and WSL1 constraints in Decodex sandbox preflight when a network proxy is active.",
    "Update Decodex network-policy readbacks to distinguish active-proxy containment from raw managed-requirements state.",
    "Check any Linux retained-lane fixtures that combine legacy landlock and network proxy permissions."
  ],
  "social_notes": [
    "Public copy should frame this as proxy containment, not a new proxy feature.",
    "Mention Linux bubblewrap caveats only if there is room."
  ],
  "caveats": [
    "The direct-network regression test is Linux-only.",
    "Bubblewrap availability can decide whether proxy containment can run on a given Linux host."
  ]
}
